{
  "goal_success": true,
  "constraint_score": 1,
  "hard_violation_count": 0,
  "optimality_gap": 0.05,
  "recovery_success": null,
  "execution_cost": 0.12,
  "latency": 1.4,
  "token_count": 512,
  "tool_calls": 1,
  "user_interventions": 1,
  "clarification_total": 1,
  "clarification_necessary": 1,
  "clarification_unnecessary": 0,
  "clarification_insufficient": 0,
  "clarification_repeated": 0,
  "clarification_incorrect_scope": 0,
  "evaluator_disagreement": 0
}
